id,game_id,name,storyline,first_release_date,follow_count,hype_count,critic_rating_value,critic_rating_count,user_rating_value,user_rating_count
4839,11194,The Legend of Zelda: Tri Force Heroes,NULL,2015-10-22 00:00:00.000,14,4,71.8571,10,64.5695,28
9426,143614,The Legend of Zelda: Skyward Sword HD,Skyward Sword takes place at the beginning of the Zelda continuity.,2021-07-15 00:00:00.000,3,2,83.4286,9,74.1904,6
10158,180897,Triforce: The Topologies of Zelda,NULL,2018-12-31 00:00:00.000,NULL,NULL,NULL,NULL,NULL,NULL
15791,136162,The Legend of Zelda: Skyward Sword - Limited Edition Pack,NULL,NULL,NULL,NULL,NULL,NULL,NULL,NULL
23861,141742,Cadence of Hyrule: Crypt of the NecroDancer Featuring The Legend of Zelda - Season Pass,"DLC Pack 1: Character Pack
Take your musical journey for a new spin with five newly added characters: Impa, Aria, Frederick, Shadow Link and Shadow Zelda.

DLC Pack 2: Melody Pack
Adds 39 new songs, including remixed versions of the game’s background music. You can change the background music at any time so you can listen to your favourite songs while journeying through Hyrule.

DLC Pack 3: Symphony of the Mask
Play as the mysterious Skull Kid and venture through a brand-new map, complete with new songs and a new story. Plus, he has the power to change abilities based on the masks he dons. What awaits Skull Kid in these strange lands?",2020-07-20 00:00:00.000,NULL,NULL,NULL,NULL,NULL,NULL
39179,45134,The Legend of Zelda: Twilight Princess HD - Special Edition,NULL,2016-03-04 00:00:00.000,1,1,NULL,NULL,NULL,NULL
43555,45139,The Legend of Zelda: Collector's Edition,NULL,2003-11-07 00:00:00.000,2,NULL,NULL,NULL,80.0460,6
45740,45143,The Legend of Zelda: Four Swords - Anniversary Edition,NULL,2011-09-28 00:00:00.000,3,NULL,NULL,NULL,69.8087,13
47130,42308,BS Zelda no Densetsu: Inishie no Sekiban,"The Hero of Light - Week 1
The events of Ancient Stone Tablets occur a mere six years after the destruction of Ganon by the hero, Link in A Link to the Past. Hyrule is enjoying a time of peace and tranquility, but Princess Zelda suffers from a dark, recurring dream showing a shadow over a temple; a premonition of evil to come. One day, she witnesses a mysterious and brilliant light in the sky to the east. Aginah, the younger brother of the wise man Sahasrahla and now living in his old hideout near the Eastern Palace also witnesses such a light, and travels to investigate. There he finds a strange youth lying on the ground. Zelda, also following the light, meets up with Aginah, and they both carry the child to rest in Sahasrahla's hideout. Confused by the youth's unusual clothes, they believe the child not to hail from Kakariko Village. Speaking to Aginah while the youngster sleeps, Zelda learns that his brother Sahasrahla had also sensed danger surrounding Hyrule and had left the land to find the hero, Link. While Link has not yet returned, Zelda senses that if this new youth was endowed with courage, he or she may be the Hero of Light.

The Monsters Return - Week 2
Some time after Zelda sets off to return to Hyrule Castle, a Soldier who guards the Eastern Palace appears before Aginah, claiming that a horde of monsters had appeared, killing the other guards protecting the temple. As the sole survivor, he passes this information on to Aginah despite his injuries. Aginah remains with the youth, hoping Zelda's belief in him or her is true. When the child awakens, Aginah informs the youngster of the monsters that are attacking their land, and explains that it is dangerous to go alone without a weapon. He states that a Sword and Shield can be found in the Eastern Palace, but he himself is too old to go there. He lends the youth an Ocarina and a Bug-Catching Net belonging to Saharshala, and also a Bottle containing a magical Golden Bee. He informs the child that the bee will attack monsters, but flee from anyone who holds a blade, and that the ocarina can be used to return to the entrance of a dungeon. With that, the new hero embarks on his or her journey.

The Tablets - Week 3
After obtaining weaponry and exploring the Eastern Palace and a dark dungeon hidden behind the Waterfall of Wishing, the hero obtains two mysterious tablets from the Dungeon Masters, the Armos Knights and Moldorm. The hero also rescues Zelda from a monster attack and escorts her to Hyrule Castle. After the hero's quests in the dungeons are completed, he or she and Aginah meet up with Zelda in the castle and proceed to study the unusual tablets. Aginah concludes that they should travel to his elder brother's house in Kakariko Village to search for clues to deciphering the markings. Unfortunately, Aginah fails to discover anything important about them, so implores the hero to travel forth and collect more of them from the dungeon monsters. After obtaining two more tablets, Zelda suggests they travel instead to Link's House to obtain the Book of Mudora, which may be able to translate the text. While Aginah searches the house, Zelda calls for the Fortune Teller to divine the location of the book, while the hero continues to search for the tablets. Aginah does eventually locate the book, upon which point he and the hero meet with Zelda at the castle.

The Silver Arrows and the Demon King - Week 4
The translated text of the tablets, written in the language of ancient Hyrule states that a sealed power, the Silver Arrows, is buried on the mountain. Aginah and the hero travel to the Sanctuary at the foot of the mountain, but Zelda follows, claiming she had another prophetic dream, this time of her holding the Book of Mudora on top of Death Mountain. Zelda insists on traveling with the hero to the summit of the mountain, as she is the only one who can read the Book of Mudora. During their quest to obtain the final two tablets and reach the summit, the Fortune Teller sees the King of Evil in a vision. Ganon's malice had kept his spirit alive despite the destruction of his body. It was this lingering evil power that had drawn the Hero of Light into the land of Hyrule, and upon the summit the hero travels once more into another world to engage in a desperate final battle with the Demon King in a new version of Ganon's Tower. Ganon desires the power of the Hero of Light to be fully reborn, but is finally destroyed using the Silver Arrows once more.",1997-03-30 00:00:00.000,1,NULL,NULL,NULL,NULL,NULL
47246,135127,Zelda Classic,NULL,1999-12-31 00:00:00.000,1,NULL,NULL,NULL,NULL,NULL
52104,45136,The Legend of Zelda: Skyward Sword Collector's Edition,NULL,NULL,1,1,NULL,NULL,NULL,NULL
56347,2276,The Legend of Zelda: The Wind Waker HD,NULL,2013-09-26 00:00:00.000,100,NULL,90.5000,12,90.2907,186
61795,1041,The Legend of Zelda: Oracle of Ages,"Transcend the very fabric of time with the Harp of Ages. Rescue Nayru, the Oracle of Ages, to save the Land of Labrynna from Veran, Sorceress of Shadows, who will pitch the world into an endless night.

Travelling through time presents Link with unique challenges. If a river blocks Link's path in the present, he can travel to the past and move a stone, redirecting the flow of water. If he plants seeds in the past, he'll find full-grown trees and vines when he returns to the present.",2001-02-27 00:00:00.000,35,NULL,95.3333,3,84.7463,103
62234,163572,The Legend of Zelda: Four Swords,NULL,2002-12-02 00:00:00.000,NULL,NULL,NULL,NULL,NULL,NULL
63130,1038,The Legend of Zelda: Spirit Tracks,"• Link has a valuable new companion. While navigating dungeons, he’s accompanied by a Phantom, a hulking suit of armor that responds to his commands. Players can tap the Phantom to take command of him, then draw a line on the touchscreen to direct him where to go. The stout Phantom can walk through fire or lava, be used as a platform to carry Link above dangers, or even run interference to block Link from harm.

• When Link conducts the train, players enjoy a satisfying combination of action and real-time puzzle solving as they determine which track to take and how to best manipulate their speed. When on the train, Link must plot the best route to the end of the line around ever-moving obstacles. While en route, Link might need to fire an onboard cannon at enemies who attack the train or sound the whistle to scare animals off the tracks.

• Link uses a variety of new items and weapons, including the Whirlwind, which players activate by blowing into the microphone of the Nintendo DS system.

• As with The Legend of Zelda: Phantom Hourglass, players can draw notes on the in-game maps using the stylus on the touch screen.",2009-12-07 00:00:00.000,34,NULL,91.6667,5,76.5687,128
71181,45135,The Legend of Zelda: The Wind Waker HD - Limited Edition,NULL,2013-12-31 00:00:00.000,1,1,NULL,NULL,NULL,NULL
73523,46620,Zelda: Mystery of The Solarus XD,NULL,NULL,NULL,NULL,NULL,NULL,NULL,NULL
75105,136337,The Legend of Zelda: Breath of the Wild - Special Edition,NULL,NULL,NULL,NULL,NULL,NULL,NULL,NULL
78204,152361,Game & Watch: The Legend of Zelda,NULL,2021-11-12 00:00:00.000,NULL,NULL,NULL,NULL,NULL,NULL
78410,1036,The Legend of Zelda: Twilight Princess,"Link, a young man from a small farming village, finds Hyrule is being consumed by an otherworldly twilight. Guided by a strange pixie named Midna, he endeavors to return light to the land and confront the usurper king Zant.",2006-11-19 00:00:00.000,257,NULL,96.2500,3,85.5053,540
79256,184332,The Legend of Zelda: Eternal Rain,NULL,2020-12-31 00:00:00.000,NULL,NULL,NULL,NULL,NULL,NULL
83058,75295,The Legend of Zelda: Breath of the Wild - Explorer's Edition,NULL,NULL,1,1,NULL,NULL,NULL,NULL
83069,44030,The Legend of Zelda: Majora's Mask 3D - Limited Edition,"Link's all-new epic adventure lands him in the mystical world of Termina, where ever-present clocks count down the hours until a menacing moon falls from the sky above. When his horse and Ocarina are stolen by a strange, masked figure, Link embarks on an urgent quest to solve the mystery of the moon, save the world from destruction, and find his way back to the peaceful land of Hyrule!",2015-03-13 00:00:00.000,1,NULL,NULL,NULL,NULL,NULL
83358,46430,The Legend of Zelda: Return of the Hylian,"After Link's victory over Ganon (in ""A Link to the Past""), no one knows what Link’s wish to the Triforce was. But this wish reunified the Light World and the Dark World and brought the 7 wise men’s descendants back to life. Peace was back in Hyrule. But unfortunately, this wish also ressurected Ganon and his henchmen. He was preparing his revenge, but he couldn’t do anything without the Triforce. One night, a familiar voice speaks to Link in his sleep…",2008-12-18 00:00:00.000,1,NULL,NULL,NULL,NULL,NULL
83399,1037,The Legend of Zelda: Phantom Hourglass,"Many months have passed since the events of The Legend of Zelda: The Wind Waker, and Link, Tetra and Tetra’s band of pirates have set sail in search of new lands. They come across a patch of ocean covered in a dense fog, in which they discover an abandoned ship. Tetra falls into danger when she explores the ship alone, and Link falls into the ocean when he attempts to rescue her. When he washes up unconscious on the shores of a mysterious island, he is awakened by the sound of a fairy’s voice. With the aid of this fairy, he sets off to find Tetra – and his way back to the seas he once knew.",2007-06-23 00:00:00.000,51,NULL,89.2500,4,76.4597,187
85316,41829,The Legend of Zelda: Breath of the Wild - Expansion Pass,NULL,2017-03-03 00:00:00.000,4,NULL,NULL,NULL,95.9857,12
91010,38319,BS Zelda no Densetsu,"At the beginning of the game, the character automatically walks into a cave, where the Old Man gives him or her the Wooden Sword. The character must complete all eight dungeons and obtain the eight pieces of the Triforce. Two of the pieces are available in each week.",1995-09-09 00:00:00.000,NULL,NULL,NULL,NULL,NULL,NULL
92713,77336,The Legend of Zelda: A Link to the Past & Four Swords,"In A Link to the Past
The intro to A Link to the Past reveals the back story of the game, showing that series antagonist Ganon was sealed away after his bid for the Triforce. However, the seal has grown weak, and a wizard named Agahnim has taken over the throne of Hyrule, and is kidnapping the seven descendants of the Sages who sealed away Ganon, which includes Princess Zelda. The game opens with series protagonist Link receiving a message from Zelda, telling him to come save her. Following his Uncle, he finds him near death, and is tasked by his Uncle to find and rescue Zelda, giving him his sword and shield before dying. After Link reaches the dungeons, he frees Zelda from her cage, and takes her through a hidden sewer into a Sanctuary, where she remains hidden. The man in the Sanctuary tells Link of Agahnim's plan to break the seal the Sages placed, requiring Link to obtain the Master Sword. Link travels across Hyrule, aided by a man named Sahasrahla, collecting three pendants from the three dungeons, using them to unseal the Master Sword in the Lost Woods. Link returns to Hyrule Castle with the Master Sword after Zelda is kidnapped. When he meets Agahnim, he finds that he is too late, as Agahnim teleports her away.

After battling and defeating Agahnim, he takes Link into the Sacred Realm, which has been corrupted and transformed into the Dark World by Ganon. He is tasked with rescuing the seven Maidens who have been sealed away in crystals, as well as finding magical items called the Silver Arrows. Link eventually rescues Zelda, and uses the Maidens' power to break into Ganon's Tower. After fighting and defeating Agahnim for the second time, Ganon flies from Agahnim's corpse into the Pyramid of Power. Link follows, doing battle with him. He eventually defeats Ganon, and finds the Triforce. After the Triforce speaks to Link, Link uses it to wish for Hyrule to return to normal. Afterward, he returns the Master Sword to where he found it. If the player has completed Four Swords, they may find an alternate ending by beating a secret dungeon. This dungeon features four Dark Links, in reference to the four Links in the Four Swords game. After defeating them, an ending showing the inhabitants of the Dark World and the various bosses is shown.

In Four Swords
Taking place before the events of Ocarina of Time, the prologue shows Link and Zelda approaching a sword in a pedestal, called the Four Sword. After Zelda explains its history and the creature sealed within it, the creature named Vaati breaks free, capturing Zelda to marry her. Link is encountered by three fairies who instruct Link to pull the Four Sword out. Link pulls the Four Sword out, inadvertently creating three copies of himself that fight alongside him. As the game begins, the four Links are tasked with finding four Great Fairies, who together will grant them access to Vaati's palace. After finding the four Great Fairies and entering the palace the Links battle Vaati. After Vaati is thoroughly weakened, he is trapped in the Four Sword. Zelda and Link return the Four Sword back in its pedestal.",2002-12-02 00:00:00.000,6,NULL,100.0000,1,86.1113,15
95070,115284,The Legend of Zelda: Link's Awakening,"Link has washed ashore on a mysterious island with strange and colorful inhabitants. To escape the island, Link must collect magical instruments across the land and awaken the Wind Fish. Explore a reimagined Koholint Island that’s been faithfully rebuilt in a brand-new art style that will entice fans and newcomers alike. Battle enemies as you conquer numerous dungeons and uncover the hidden secrets of the island. Encounter Super Mario enemies like Goombas, Piranha Plants, and more, and interact with unique locals who help Link on his adventure. As you clear dungeons throughout the main story, earn dungeon rooms (Chambers), then arrange them into custom layouts in the all-new Chamber Dungeon. Place your dungeon entrance, Nightmare room, and everything in between as you try to fulfill objectives and play through a new dungeon. Tap compatible amiibo figures to earn more Chambers and and additional Chambers throughout the game in updated mini-games, such as the river rapids, trendy game, and fishing.",2019-09-20 00:00:00.000,33,13,86.6429,16,83.8661,132
95322,191440,The Legend of Zelda: Twilight Princess,NULL,2017-12-05 00:00:00.000,NULL,NULL,NULL,NULL,NULL,NULL
98984,136280,Classic NES Series: Zelda II - The Adventure of Link,NULL,2004-08-10 00:00:00.000,NULL,NULL,NULL,NULL,NULL,NULL
100307,152362,Zelda,"As the eight dragons cannot live in peace with humans, they decide to take over the world. Eventually, they kidnap Princess Zelda and lock her in a dungeon which can only be opened with the Triforce. Each of the dragons is located in their own labyrinth, and each guards a different fragment of the Triforce. Link sets out to destroy all eight dragons and reassemble the Triforce to free Zelda from the dragons' dungeon. Once Link defeats the last dragon, he reassembles the Triforce and frees Zelda from her prison.",1989-08-26 00:00:00.000,NULL,NULL,NULL,NULL,NULL,NULL
100550,50598,The Legend Of Zelda: Breath of the Wild - Limited Edition,NULL,2017-03-02 00:00:00.000,NULL,NULL,NULL,NULL,NULL,NULL
100660,142889,Paper Zelda RPG,NULL,NULL,NULL,NULL,NULL,NULL,NULL,NULL
101079,91680,The Legend of Zelda: Tetra's Trackers,NULL,NULL,NULL,NULL,NULL,NULL,NULL,NULL
102230,141589,The Legend of Zelda: Majora's Mask 3D - Special Edition,NULL,2015-02-13 00:00:00.000,1,1,NULL,NULL,NULL,NULL
105569,45133,The Legend of Zelda: The Wind Waker HD Bundle Limited Edition,NULL,2013-12-31 00:00:00.000,1,1,NULL,NULL,NULL,NULL
108291,136899,The Legend of Zelda: Link's Awakening - Artbook Set,NULL,2019-09-20 00:00:00.000,NULL,NULL,NULL,NULL,NULL,NULL
109649,136334,The Legend of Zelda: Link's Awakening - Dreamer Edition,NULL,2019-09-20 00:00:00.000,NULL,NULL,NULL,NULL,NULL,NULL
109668,134231,The Legend of Zelda: Link's Awakening - Limited Edition,NULL,2019-09-20 00:00:00.000,NULL,NULL,NULL,NULL,NULL,NULL
111728,28864,Zelda Mobile,NULL,2010-05-23 00:00:00.000,NULL,NULL,NULL,NULL,NULL,NULL
113453,163216,The Legend of Zelda: Triforce of the Gods,NULL,2004-12-31 00:00:00.000,NULL,NULL,NULL,NULL,NULL,NULL
119080,1026,The Legend of Zelda: A Link to the Past,"The plot of A Link to the Past focuses on Link as he travels on a journey to save Hyrule, defeat Ganon and rescue the seven descendants of the Sages. A Link to the Past uses a 3/4 top-down perspective similar to that of the original The Legend of Zelda, dropping the side scrolling elements of Zelda II: The Adventure of Link. A Link to the Past introduced elements to the series that are still commonplace today, such as the concept of an alternate or parallel world, the Master Sword and other new weapons and items.",1991-11-21 00:00:00.000,449,NULL,100.0000,1,92.4196,1108
119483,1033,The Legend of Zelda: The Wind Waker,NULL,2002-12-13 00:00:00.000,280,NULL,90.0000,1,87.9759,697
119611,2909,The Legend of Zelda: A Link Between Worlds,"The events of A Link Between Worlds take place six generations after the events of A Link to the Past. The legend of the legendary hero's battles against Ganon has been passed down from generation to generation, and peace has ruled for decades. The game's incarnation of Link is an apprentice blacksmith to Hyrule's greatest Blacksmith.

Beset by a nightmare of the sacred Triforce being destroyed and facing a gargantuan evil creature, Link is awakened from his sleep by Gulley, the Blacksmith's son. Link rushes over to the smithery, where the Captain of Hyrule's knights has stopped by to retrieve his sword and shield. After Link is scolded for being late, the Blacksmith's Wife notices that the Captain forgot to bring his sword along with him when he left. Link is tasked with traveling to Hyrule Castle to return it to its rightful owner. Once Link arrives at the castle however, he is told that the Captain went to the Sanctuary. Upon his arrival there, however, the villain Yuga appears, and turns both Seres and the Captain into paintings with his wicked magic. Link lunges at Yuga, but Yuga is able to use his magic to turn himself into a wall painting, causing Link to crash straight into the wall. Yuga then returns to his original form, kicking Link to the floor in the process. As Yuga leaves with Seres in tow, the Priest says to warn Princess Zelda of this before Link passes out.",2013-11-22 00:00:00.000,210,6,92.3333,17,88.2223,484
127840,176087,The Legend of Zelda: Ocarina of Time + The Legend of Zelda: Ocarina of Time - Master Quest - Two-game Bonus Disc!,NULL,2002-11-28 00:00:00.000,NULL,NULL,NULL,NULL,NULL,NULL
127907,45142,The Legend of Zelda: Ocarina of Time - Master Quest,NULL,2003-02-28 00:00:00.000,5,NULL,NULL,NULL,89.9568,17
135495,89904,The Legend of Zelda Ocarina of Time 3D: First Edition,NULL,2011-06-19 00:00:00.000,NULL,NULL,NULL,NULL,NULL,NULL
140819,1029,The Legend of Zelda: Ocarina of Time,NULL,1998-11-21 00:00:00.000,627,2,NULL,NULL,91.9234,1362
141585,1030,The Legend of Zelda: Majora's Mask,NULL,2000-04-27 00:00:00.000,189,NULL,90.0000,0,87.2750,552
145765,18017,The Legend of Zelda: Twilight Princess HD,NULL,2016-03-04 00:00:00.000,32,3,85.7500,14,84.3711,69
147691,45137,The Legend of Zelda: Breath of the Wild - Master Edition,NULL,NULL,1,1,NULL,NULL,NULL,NULL
149468,8533,Zelda: The Wand of Gamelon,"King Harkinian announces his plan to aid Duke Onkled of Gamelon, who is under attack by Ganon, and orders Zelda to send Link for backup if she does not hear from him within a month. A month passes without word from the King, so Zelda sends Link to find him. Unfortunately, he too goes missing, so Zelda ventures off to Gamelon to find both Link and the King, accompanied by her elderly nursemaid Impa.

During Zelda's time in Gamelon, Impa discovers that King Harkinian has been captured, and that Link has engaged in a battle, the outcome of which is unclear. As she adventures across the island, Zelda defeats many of Ganon's minions and frees a woman named Lady Alma, who gives Zelda a canteen that she claims Link gave her in exchange for a kiss. On reaching Duke Onkled's palace, it is revealed that the Duke has betrayed the King and is working for Ganon. Zelda storms the palace, kills Ganon's henchmen, and saves a prisoner named Lord Kiro (sometimes known as Fari) who used to work for King Harkinian. Kiro reveals the secret entrance to Onkled's chamber, and when they confront him he reveals the entrance to Reesong Palace, where Ganon has taken residence.

Zelda travels to the Shrine of Gamelon to obtain the Wand needed to defeat Ganon, then makes her way to Reesong Palace where she fights him. After incapacitating Ganon with the Wand, she rescues her father. Back at Hyrule Castle, Duke Onkled is turned over to the king, begging for mercy. He is arrested and the King orders him to scrub all the floors in Hyrule as punishment. Although Link's whereabouts are still unknown, a comment by Lady Alma prompts Zelda to throw her mirror against the wall, and as it smashes, Link magically materializes, seemingly having been trapped in the mirror. They begin laughing, as all is well once again.",1993-10-10 00:00:00.000,2,NULL,NULL,NULL,39.8390,6
149535,136841,The Legend of Zelda: Breath of the Wild - Collector's Edition,NULL,2017-11-23 00:00:00.000,NULL,NULL,NULL,NULL,NULL,NULL
154107,119388,The Legend of Zelda: Breath of the Wild 2,NULL,2023-03-31 00:00:00.000,1,48,NULL,NULL,NULL,NULL
155452,172690,The Legend of Zelda: Picross,"The insane desire of Ganon for the Triforce changes the kingdom into picross grids. The weird curse changes the landscape, slicing the Kingdom in squares. Faced with the squared land, Link storms out to defeat Ganon and to save his princess.",2017-01-02 00:00:00.000,NULL,NULL,NULL,NULL,NULL,NULL
161622,116419,Cadence of Hyrule: Crypt of the NecroDancer Featuring The Legend of Zelda,"In the Kingdom of Hyrule, a mysterious man named Octavo uses a magical Lute to put Hyrule's king, as well as Link and Zelda, to sleep, before using the Triforce of Power to turn his Lute into a Golden Lute. In this time of need, Cadence is mysteriously transported to Hyrule by the Triforce and manages to wake up Link and Zelda. While Cadence goes off to try to find a way home, Link and Zelda travel across Hyrule to find and defeat Octavo's four champions, who each possess enchanted instruments containing musical power. After Link and Zelda, soon rejoined by Cadence, obtain the instruments and enter Hyrule Castle, Octavo reveals that he and his champions were meant to be used to battle against Ganon, who will take over Hyrule in the future. Finding himself defeated, Octavo opens a portal into the future, where Link, Zelda, and Cadence confront Ganon and combine their forces to defeat him. With help from the Golden Lute, Link and Zelda use the power of the Triforce to try and send Cadence back to her own world.",2019-06-13 00:00:00.000,4,2,81.8571,9,74.1037,34
162361,58782,My Nintendo Picross: The Legend of Zelda Twilight Princess,NULL,2016-03-31 00:00:00.000,NULL,NULL,60.0000,1,70.0075,8
163628,18066,Classic NES Series: The Legend of Zelda,NULL,2004-02-14 00:00:00.000,2,NULL,NULL,NULL,NULL,NULL
164496,134500,BS Zelda no Densetsu Map 2,"At the beginning of the game, the character automatically walks into a cave, where the Old Man gives him or her the Wooden Sword. The character must complete all eight dungeons and obtain the eight pieces of the Triforce. Two of the pieces are available in each week.",1995-12-30 00:00:00.000,NULL,NULL,NULL,NULL,NULL,NULL
164972,8534,Zelda's Adventure,NULL,1994-06-05 00:00:00.000,2,NULL,NULL,NULL,10.0675,6
