id,game_id,name,storyline,first_release_date,follow_count,hype_count,critic_rating_value,critic_rating_count,user_rating_value,user_rating_count
165441,1032,The Legend of Zelda: Oracle of Seasons,"The land of Holodrum is slowly withering. Onox, the General of Darkness, has imprisoned the Oracle of Seasons and is draining the very life out of the land. With the seasons in tumult and the forces of evil running rampant, the world looks for a hero... and finds Link. His quest won't be easy - he'll have to master the seasons themselves if he's to turn back the evil tide.",2001-02-27 00:00:00.000,37,NULL,93.0000,2,82.5434,118
166093,1028,The Legend of Zelda: Link's Awakening,"After the events of A Link to the Past, the hero Link travels by ship to other countries to train for further threats. A storm destroys his boat at sea, and he washes ashore on Koholint Island where he is taken to the house of Tarin by his daughter Marin. She is fascinated by Link and the outside world, and tells Link wishfully that, if she were a seagull, she would leave and travel across the sea. After Link recovers his sword, a mysterious owl tells him that he must wake the Wind Fish, Koholint's guardian, in order to return home. The Wind Fish lies dreaming in a giant egg on top of Mt. Tamaranch, and can only be awakened by the eight Instruments of the Sirens.

Link proceeds to explore a series of dungeons in order to recover the eight instruments. During his search for the sixth instrument, Link goes to the Ancient Ruins. There he finds a mural that details the reality of the island: that it is merely a dream world created by the Wind Fish. After this revelation, the owl tells Link that this is only a rumor, and only the Wind Fish knows for certain whether it is true. Throughout Koholint Island, nightmare creatures attempt to obstruct Link's quest for the instruments, as they wish to rule the Wind Fish's dreamworld.

After collecting all eight instruments from the eight dungeons across Koholint, Link climbs to the top of Mt. Tamaranch and plays the Ballad of the Wind Fish. This breaks open the egg in which the Wind Fish sleeps; Link enters and confronts the last evil being, a Nightmare that takes the form of Ganon and other enemies from Link's past.[24] Its final transformation is ""DethI"", a cyclopean, dual-tentacled Shadow. After Link defeats DethI, the owl reveals itself to be the Wind Fish's spirit, and the Wind Fish confirms that Koholint is all his dream. When Link plays the Ballad of the Wind Fish again, he and the Wind Fish awaken; Koholint Island and all its inhabitants slowly disappear. Link finds himself lying on his ship's driftwood in the middle of the ocean, with the Wind Fish flying overhead. If the player did not lose any lives during the game, Marin is shown flying after the ending credits finish.",1993-06-06 00:00:00.000,66,NULL,80.0000,0,85.9132,156
166377,534,The Legend of Zelda: Skyward Sword,"The game's storyline is the earliest in Zelda continuity, preceding The Legend of Zelda: The Minish Cap. Skyward Sword follows an incarnation of the series protagonist Link who was raised in a society above the clouds known as Skyloft. After his closest childhood friend, Zelda, is swept into the land below the clouds by demonic forces, Link does whatever it takes to save her, traveling between Skyloft and the surface below while battling the dark forces of the self-proclaimed ""Demon Lord"", Ghirahim.",2011-11-18 00:00:00.000,115,NULL,92.7143,10,82.0815,279
170651,1034,The Legend of Zelda: Four Swords Adventures,NULL,2004-03-18 00:00:00.000,18,NULL,85.0000,3,67.5293,43
170661,1027,The Legend of Zelda: Link's Awakening DX,"The island's inhabitants have no knowledge of the outside world. One creature, a talking owl, may know the solution to Link's dilemma. Link must first tackle eight dungeons full of treacherous monsters and tricky traps. His goal: find the eight Instruments of the Sirens and awaken the omnipotent Wind Fish which rules the island.",1998-12-01 00:00:00.000,45,NULL,NULL,NULL,87.9228,129
171521,172501,The Legend of Zelda Game Watch,NULL,NULL,NULL,NULL,NULL,NULL,NULL,NULL
171650,134014,The Legend of Zelda: Twilight Princess,"Link, a young man from a small farming village, finds Hyrule is being consumed by an otherworldly twilight. Guided by a strange pixie named Midna, he endeavors to return light to the land and confront the usurper king Zant.",2006-11-19 00:00:00.000,NULL,NULL,97.5000,2,NULL,NULL
171891,8593,The Legend of Zelda: Majora's Mask 3D,NULL,2015-02-12 00:00:00.000,53,1,91.1538,14,91.2898,112
172623,7346,The Legend of Zelda: Breath of the Wild,Link awakes in a mysterious chamber after 100 years of slumber to find that Calamity Ganon has taken over Hyrule Castle and left Hyrule to decay and be taken over by nature.,2017-03-03 00:00:00.000,691,142,97.5926,31,92.0993,1568
173263,1035,The Legend of Zelda: The Minish Cap,NULL,2004-11-04 00:00:00.000,89,NULL,90.0000,1,84.0738,281
